{
  "drug_name": "Darbepoetin alfa",
  "indication": "Small Cell Lung Cancer (SCLC), Extensive Stage",
  "trial_design": {
    "cycle_length_days": 21
  },
  "demographics": {
    "age": {
      "type": "numeric",
      "distribution": "normal",
      "params": {
        "mean": 60.9,
        "std": 9.2,
        "min": 28,
        "max": 81
      }
    },
    "sex": {
      "type": "categorical",
      "options": {
        "Male": 0.63,
        "Female": 0.37
      }
    },
    "race": {
      "type": "categorical",
      "options": {
        "White": 1.0
      }
    },
    "ecog_ps": {
      "type": "categorical",
      "options": {
        "0": 0.2,
        "1": 0.6,
        "2": 0.2
      }
    },
    "bmi": {
      "type": "numeric",
      "distribution": "normal",
      "params": {
        "mean": 24.8,
        "std": 4.3,
        "min": 15.6,
        "max": 41.7
      }
    }
  },
  "comorbidities": [
    {
      "condition": "hypertension",
      "base_probability": 0.364,
      "conditional_modifiers": []
    },
    {
      "condition": "cardiovascular_disease",
      "base_probability": 0.314,
      "conditional_modifiers": []
    },
    {
      "condition": "copd",
      "base_probability": 0.326,
      "conditional_modifiers": []
    },
    {
      "condition": "gastrointestinal_disease",
      "base_probability": 0.255,
      "conditional_modifiers": []
    },
    {
      "condition": "diabetes",
      "base_probability": 0.113,
      "conditional_modifiers": []
    },
    {
      "condition": "hepatic_impairment",
      "base_probability": 0.059,
      "conditional_modifiers": []
    },
    {
      "condition": "chronic_kidney_disease",
      "base_probability": 0.054,
      "conditional_modifiers": []
    },
    {
      "condition": "thromboembolism",
      "base_probability": 0.042,
      "conditional_modifiers": []
    }
  ],
  "disease_baseline": {
    "tumor_sites": {
      "lung": 1.0,
      "bone": 0.076,
      "brain": 0.029
    },
    "n_target_lesions": {
      "type": "categorical",
      "options": {
        "0": 0.342,
        "1": 0.252,
        "2": 0.167,
        "3": 0.103,
        "4": 0.021,
        "5+": 0.115
      }
    },
    "sum_of_diameters_mm": {
      "type": "numeric",
      "distribution": "lognormal",
      "params": {
        "mean": 166.3,
        "std": 96.2,
        "min": 15,
        "max": 594
      }
    },
    "tumor_response_distribution": {
      "CR": 0.074,
      "PR": 0.721,
      "SD": 0.162,
      "PD": 0.044
    },
    "ldh_uln_ratio": {
      "type": "numeric",
      "distribution": "lognormal",
      "params": {
        "mean": 2.66,
        "std": 3.09,
        "min": 0.46,
        "max": 33.69
      }
    },
    "albumin_gdl": {
      "type": "numeric",
      "distribution": "normal",
      "params": {
        "mean": 3.76,
        "std": 0.5,
        "min": 2.3,
        "max": 4.9
      }
    }
  },
  "ae_profile": [
    {
      "ae_term": "nausea",
      "incidence_all_grade": 0.469,
      "grade_distribution": {
        "1": 0.652,
        "2": 0.304,
        "3": 0.045
      },
      "onset_day": {
        "type": "numeric",
        "distribution": "lognormal",
        "params": {
          "mean": 31.1,
          "std": 37.0,
          "min": 1,
          "max": 137
        }
      },
      "duration_days": {
        "type": "numeric",
        "distribution": "lognormal",
        "params": {
          "mean": 11.0,
          "std": 26.3,
          "min": 1,
          "max": 154
        }
      },
      "risk_modifiers": [],
      "cumulative": false,
      "reversible": true
    },
    {
      "ae_term": "neutropenia",
      "incidence_all_grade": 0.377,
      "grade_distribution": {
        "1": 0.133,
        "2": 0.433,
        "3": 0.378,
        "4": 0.056
      },
      "onset_day": {
        "type": "numeric",
        "distribution": "lognormal",
        "params": {
          "mean": 33.9,
          "std": 29.7,
          "min": 1,
          "max": 155
        }
      },
      "duration_days": {
        "type": "numeric",
        "distribution": "lognormal",
        "params": {
          "mean": 9.7,
          "std": 7.8,
          "min": 1,
          "max": 78
        }
      },
      "risk_modifiers": [
        {
          "condition": "comorb_chronic_kidney_disease == 1",
          "incidence_multiplier": 1.37
        }
      ],
      "cumulative": false,
      "reversible": true
    },
    {
      "ae_term": "vomiting",
      "incidence_all_grade": 0.297,
      "grade_distribution": {
        "1": 0.352,
        "2": 0.535,
        "3": 0.113
      },
      "onset_day": {
        "type": "numeric",
        "distribution": "lognormal",
        "params": {
          "mean": 36.1,
          "std": 32.5,
          "min": 1,
          "max": 118
        }
      },
      "duration_days": {
        "type": "numeric",
        "distribution": "lognormal",
        "params": {
          "mean": 9.6,
          "std": 21.6,
          "min": 1,
          "max": 154
        }
      },
      "risk_modifiers": [],
      "cumulative": false,
      "reversible": true
    },
    {
      "ae_term": "alopecia",
      "incidence_all_grade": 0.238,
      "grade_distribution": {
        "1": 0.263,
        "2": 0.561,
        "3": 0.175
      },
      "onset_day": {
        "type": "numeric",
        "distribution": "lognormal",
        "params": {
          "mean": 31.5,
          "std": 20.3,
          "min": 1,
          "max": 106
        }
      },
      "duration_days": {
        "type": "numeric",
        "distribution": "lognormal",
        "params": {
          "mean": 88.0,
          "std": 51.2,
          "min": 1,
          "max": 170
        }
      },
      "risk_modifiers": [],
      "cumulative": true,
      "reversible": true
    },
    {
      "ae_term": "thrombocytopenia",
      "incidence_all_grade": 0.205,
      "grade_distribution": {
        "1": 0.204,
        "2": 0.408,
        "3": 0.347,
        "4": 0.041
      },
      "onset_day": {
        "type": "numeric",
        "distribution": "lognormal",
        "params": {
          "mean": 57.1,
          "std": 41.0,
          "min": 1,
          "max": 156
        }
      },
      "duration_days": {
        "type": "numeric",
        "distribution": "lognormal",
        "params": {
          "mean": 11.0,
          "std": 13.6,
          "min": 1,
          "max": 105
        }
      },
      "risk_modifiers": [],
      "cumulative": false,
      "reversible": true
    },
    {
      "ae_term": "anorexia",
      "incidence_all_grade": 0.172,
      "grade_distribution": {
        "1": 0.585,
        "2": 0.341,
        "3": 0.073
      },
      "onset_day": {
        "type": "numeric",
        "distribution": "lognormal",
        "params": {
          "mean": 52.2,
          "std": 48.8,
          "min": 1,
          "max": 197
        }
      },
      "duration_days": {
        "type": "numeric",
        "distribution": "lognormal",
        "params": {
          "mean": 18.6,
          "std": 14.2,
          "min": 1,
          "max": 58
        }
      },
      "risk_modifiers": [],
      "cumulative": false,
      "reversible": true
    },
    {
      "ae_term": "constipation",
      "incidence_all_grade": 0.159,
      "grade_distribution": {
        "1": 0.605,
        "2": 0.368,
        "3": 0.026
      },
      "onset_day": {
        "type": "numeric",
        "distribution": "lognormal",
        "params": {
          "mean": 31.9,
          "std": 33.0,
          "min": 1,
          "max": 154
        }
      },
      "duration_days": {
        "type": "numeric",
        "distribution": "lognormal",
        "params": {
          "mean": 22.4,
          "std": 60.3,
          "min": 1,
          "max": 385
        }
      },
      "risk_modifiers": [],
      "cumulative": false,
      "reversible": true
    },
    {
      "ae_term": "fatigue",
      "incidence_all_grade": 0.146,
      "grade_distribution": {
        "1": 0.371,
        "2": 0.4,
        "3": 0.229
      },
      "onset_day": {
        "type": "numeric",
        "distribution": "lognormal",
        "params": {
          "mean": 52.7,
          "std": 44.3,
          "min": 1,
          "max": 160
        }
      },
      "duration_days": {
        "type": "numeric",
        "distribution": "lognormal",
        "params": {
          "mean": 17.1,
          "std": 19.5,
          "min": 1,
          "max": 93
        }
      },
      "risk_modifiers": [],
      "cumulative": false,
      "reversible": true
    },
    {
      "ae_term": "diarrhoea",
      "incidence_all_grade": 0.13,
      "grade_distribution": {
        "1": 0.387,
        "2": 0.484,
        "3": 0.129
      },
      "onset_day": {
        "type": "numeric",
        "distribution": "lognormal",
        "params": {
          "mean": 38.5,
          "std": 48.9,
          "min": 1,
          "max": 166
        }
      },
      "duration_days": {
        "type": "numeric",
        "distribution": "lognormal",
        "params": {
          "mean": 7.6,
          "std": 10.2,
          "min": 1,
          "max": 40
        }
      },
      "risk_modifiers": [],
      "cumulative": false,
      "reversible": true
    },
    {
      "ae_term": "insomnia",
      "incidence_all_grade": 0.126,
      "grade_distribution": {
        "1": 0.767,
        "2": 0.233
      },
      "onset_day": {
        "type": "numeric",
        "distribution": "lognormal",
        "params": {
          "mean": 55.6,
          "std": 54.8,
          "min": 1,
          "max": 180
        }
      },
      "duration_days": {
        "type": "numeric",
        "distribution": "lognormal",
        "params": {
          "mean": 11.7,
          "std": 19.2,
          "min": 1,
          "max": 82
        }
      },
      "risk_modifiers": [],
      "cumulative": false,
      "reversible": true
    },
    {
      "ae_term": "cough",
      "incidence_all_grade": 0.121,